[
{
"id": "fx-000",
"cheeseName": "Fixture cheese 0",
"tastedAt": "2026-01-01",
"createdAt": "2026-01-01T12:00:00.000Z",
"milk": "cow",
"rating": 0,
"priceUnit": "usdPerLb",
"isGrassfed": false,
"isRaw": false,
"texture": "semiFirm",
"notes": "",
"flavors": {
"caramel": 3,
"nutty": 3,
"earthy": 3,
"grassy": 3,
"salty": 3,
"sweet": 3,
"butteryCreamy": 3,
"lemon": 1
}
},
{
"id": "fx-001",
"cheeseName": "Fixture cheese 1",
"tastedAt": "2026-01-02",
"createdAt": "2026-01-02T12:00:00.000Z",
"milk": "cow",
"rating": 0,
"priceUnit": "usdPerLb",
"isGrassfed": false,
"isRaw": false,
"texture": "semiFirm",
"notes": "",
"flavors": {
"caramel": 4,
"nutty": 4,
"earthy": 4,
"grassy": 4,
"salty": 4,
"sweet": 4,
"butteryCreamy": 4
}
},
{
"id": "fx-002",
"cheeseName": "Fixture cheese 2",
"tastedAt": "2026-01-03",
"createdAt": "2026-01-03T12:00:00.000Z",
"milk": "cow",
"rating": 0,
"priceUnit": "usdPerLb",
"isGrassfed": false,
"isRaw": false,
"texture": "semiFirm",
"notes": "",
"flavors": {
"caramel": 5,
"nutty": 5,
"earthy": 5,
"grassy": 5,
"salty": 5,
"sweet": 5,
"butteryCreamy": 5
}
},
{
"id": "fx-003",
"cheeseName": "Fixture cheese 3",
"tastedAt": "2026-01-04",
"createdAt": "2026-01-04T12:00:00.000Z",
"milk": "cow",
"rating": 0,
"priceUnit": "usdPerLb",
"isGrassfed": false,
"isRaw": false,
"texture": "semiFirm",
"notes": "",
"flavors": {
"caramel": 3,
"nutty": 3,
"earthy": 3,
"grassy": 3,
"salty": 3,
"sweet": 3
}
},
{
"id": "fx-004",
"cheeseName": "Fixture cheese 4",
"tastedAt": "2026-01-05",
"createdAt": "2026-01-05T12:00:00.000Z",
"milk": "cow",
"rating": 0,
"priceUnit": "usdPerLb",
"isGrassfed": false,
"isRaw": false,
"texture": "semiFirm",
"notes": "",
"flavors": {
"caramel": 4,
"nutty": 4,
"earthy": 4,
"grassy": 4,
"salty": 4,
"sweet": 4
}
},
{
"id": "fx-005",
"cheeseName": "Fixture cheese 5",
"tastedAt": "2026-01-06",
"createdAt": "2026-01-06T12:00:00.000Z",
"milk": "cow",
"rating": 0,
"priceUnit": "usdPerLb",
"isGrassfed": false,
"isRaw": false,
"texture": "semiFirm",
"notes": "",
"flavors": {
"caramel": 5,
"nutty": 5,
"earthy": 5,
"grassy": 5,
"salty": 5,
"sweet": 5,
"lemon": 2
}
},
{
"id": "fx-006",
"cheeseName": "Fixture cheese 6",
"tastedAt": "2026-01-07",
"createdAt": "2026-01-07T12:00:00.000Z",
"milk": "cow",
"rating": 0,
"priceUnit": "usdPerLb",
"isGrassfed": false,
"isRaw": false,
"texture": "semiFirm",
"notes": "",
"flavors": {
"caramel": 3,
"nutty": 3,
"earthy": 3,
"grassy": 3,
"salty": 3
}
},
{
"id": "fx-007",
"cheeseName": "Fixture cheese 7",
"tastedAt": "2026-01-08",
"createdAt": "2026-01-08T12:00:00.000Z",
"milk": "cow",
"rating": 0,
"priceUnit": "usdPerLb",
"isGrassfed": false,
"isRaw": false,
"texture": "semiFirm",
"notes": "",
"flavors": {
"caramel": 4,
"nutty": 4,
"earthy": 4,
"grassy": 4,
"salty": 4
}
},
{
"id": "fx-008",
"cheeseName": "Fixture cheese 8",
"tastedAt": "2026-01-09",
"createdAt": "2026-01-09T12:00:00.000Z",
"milk": "cow",
"rating": 4,
"priceUnit": "usdPerLb",
"isGrassfed": false,
"isRaw": false,
"texture": "semiFirm",
"notes": "",
"flavors": {
"caramel": 5,
"nutty": 5,
"earthy": 5,
"grassy": 5,
"salty": 5
}
},
{
"id": "fx-009",
"cheeseName": "Fixture cheese 9",
"tastedAt": "2026-01-10",
"createdAt": "2026-01-10T12:00:00.000Z",
"milk": "cow",
"rating": 4,
"priceUnit": "usdPerLb",
"isGrassfed": false,
"isRaw": false,
"texture": "semiFirm",
"notes": "",
"flavors": {
"caramel": 3,
"nutty": 3,
"earthy": 3,
"grassy": 3
}
},
{
"id": "fx-010",
"cheeseName": "Fixture cheese 10",
"tastedAt": "2026-01-11",
"createdAt": "2026-01-11T12:00:00.000Z",
"milk": "cow",
"rating": 4,
"priceUnit": "usdPerLb",
"isGrassfed": false,
"isRaw": false,
"texture": "semiFirm",
"notes": "",
"flavors": {
"caramel": 4,
"nutty": 4,
"earthy": 4,
"grassy": 4,
"lemon": 1
}
},
{
"id": "fx-011",
"cheeseName": "Fixture cheese 11",
"tastedAt": "2026-01-12",
"createdAt": "2026-01-12T12:00:00.000Z",
"milk": "cow",
"rating": 4,
"priceUnit": "usdPerLb",
"isGrassfed": false,
"isRaw": false,
"texture": "semiFirm",
"notes": "",
"flavors": {
"caramel": 5,
"nutty": 5,
"earthy": 5,
"grassy": 5
}
},
{
"id": "fx-012",
"cheeseName": "Fixture cheese 12",
"tastedAt": "2026-01-13",
"createdAt": "2026-01-13T12:00:00.000Z",
"milk": "cow",
"rating": 4,
"priceUnit": "usdPerLb",
"isGrassfed": false,
"isRaw": false,
"texture": "semiFirm",
"notes": "",
"flavors": {
"caramel": 3,
"nutty": 3,
"earthy": 3,
"grassy": 3
}
},
{
"id": "fx-013",
"cheeseName": "Fixture cheese 13",
"tastedAt": "2026-01-14",
"createdAt": "2026-01-14T12:00:00.000Z",
"milk": "cow",
"rating": 4,
"priceUnit": "usdPerLb",
"isGrassfed": false,
"isRaw": false,
"texture": "semiFirm",
"notes": "",
"flavors": {
"caramel": 4,
"nutty": 4,
"earthy": 4,
"grassy": 4
}
},
{
"id": "fx-014",
"cheeseName": "Fixture cheese 14",
"tastedAt": "2026-01-15",
"createdAt": "2026-01-15T12:00:00.000Z",
"milk": "cow",
"rating": 4,
"priceUnit": "usdPerLb",
"isGrassfed": false,
"isRaw": false,
"texture": "semiFirm",
"notes": "",
"flavors": {
"caramel": 5,
"nutty": 5,
"earthy": 5
}
},
{
"id": "fx-015",
"cheeseName": "Fixture cheese 15",
"tastedAt": "2026-01-16",
"createdAt": "2026-01-16T12:00:00.000Z",
"milk": "cow",
"rating": 4,
"priceUnit": "usdPerLb",
"isGrassfed": false,
"isRaw": false,
"texture": "semiFirm",
"notes": "",
"flavors": {
"caramel": 3,
"nutty": 3,
"earthy": 3,
"lemon": 2
}
},
{
"id": "fx-016",
"cheeseName": "Fixture cheese 16",
"tastedAt": "2026-01-17",
"createdAt": "2026-01-17T12:00:00.000Z",
"milk": "cow",
"rating": 4,
"priceUnit": "usdPerLb",
"isGrassfed": false,
"isRaw": false,
"texture": "semiFirm",
"notes": "",
"flavors": {
"caramel": 4,
"nutty": 4,
"earthy": 4
}
},
{
"id": "fx-017",
"cheeseName": "Fixture cheese 17",
"tastedAt": "2026-01-18",
"createdAt": "2026-01-18T12:00:00.000Z",
"milk": "cow",
"rating": 4,
"priceUnit": "usdPerLb",
"isGrassfed": false,
"isRaw": false,
"texture": "semiFirm",
"notes": "",
"flavors": {
"caramel": 5,
"nutty": 5,
"earthy": 5
}
},
{
"id": "fx-018",
"cheeseName": "Fixture cheese 18",
"tastedAt": "2026-01-19",
"createdAt": "2026-01-19T12:00:00.000Z",
"milk": "cow",
"rating": 4,
"priceUnit": "usdPerLb",
"isGrassfed": false,
"isRaw": false,
"texture": "semiFirm",
"notes": "",
"flavors": {
"caramel": 3,
"nutty": 3,
"earthy": 3
}
},
{
"id": "fx-019",
"cheeseName": "Fixture cheese 19",
"tastedAt": "2026-01-20",
"createdAt": "2026-01-20T12:00:00.000Z",
"milk": "cow",
"rating": 4,
"priceUnit": "usdPerLb",
"isGrassfed": false,
"isRaw": false,
"texture": "semiFirm",
"notes": "",
"flavors": {
"caramel": 4,
"nutty": 4,
"earthy": 4
}
},
{
"id": "fx-020",
"cheeseName": "Fixture cheese 20",
"tastedAt": "2026-01-21",
"createdAt": "2026-01-21T12:00:00.000Z",
"milk": "cow",
"rating": 4,
"priceUnit": "usdPerLb",
"isGrassfed": false,
"isRaw": false,
"texture": "semiFirm",
"notes": "",
"flavors": {
"caramel": 5,
"nutty": 5,
"earthy": 5,
"lemon": 1
}
},
{
"id": "fx-021",
"cheeseName": "Fixture cheese 21",
"tastedAt": "2026-01-22",
"createdAt": "2026-01-22T12:00:00.000Z",
"milk": "cow",
"rating": 4,
"priceUnit": "usdPerLb",
"isGrassfed": false,
"isRaw": false,
"texture": "semiFirm",
"notes": "",
"flavors": {
"caramel": 3,
"nutty": 3
}
},
{
"id": "fx-022",
"cheeseName": "Fixture cheese 22",
"tastedAt": "2026-01-23",
"createdAt": "2026-01-23T12:00:00.000Z",
"milk": "cow",
"rating": 4,
"priceUnit": "usdPerLb",
"isGrassfed": false,
"isRaw": false,
"texture": "semiFirm",
"notes": "",
"flavors": {
"caramel": 4,
"nutty": 4
}
},
{
"id": "fx-023",
"cheeseName": "Fixture cheese 23",
"tastedAt": "2026-01-24",
"createdAt": "2026-01-24T12:00:00.000Z",
"milk": "cow",
"rating": 4,
"priceUnit": "usdPerLb",
"isGrassfed": false,
"isRaw": false,
"texture": "semiFirm",
"notes": "",
"flavors": {
"caramel": 5,
"nutty": 5
}
},
{
"id": "fx-024",
"cheeseName": "Fixture cheese 24",
"tastedAt": "2026-01-25",
"createdAt": "2026-01-25T12:00:00.000Z",
"milk": "cow",
"rating": 4,
"priceUnit": "usdPerLb",
"isGrassfed": false,
"isRaw": false,
"texture": "semiFirm",
"notes": "",
"flavors": {
"caramel": 3,
"nutty": 3
}
},
{
"id": "fx-025",
"cheeseName": "Fixture cheese 25",
"tastedAt": "2026-01-26",
"createdAt": "2026-01-26T12:00:00.000Z",
"milk": "cow",
"rating": 4,
"priceUnit": "usdPerLb",
"isGrassfed": false,
"isRaw": false,
"texture": "semiFirm",
"notes": "",
"flavors": {
"caramel": 4,
"nutty": 4,
"lemon": 2
}
},
{
"id": "fx-026",
"cheeseName": "Fixture cheese 26",
"tastedAt": "2026-01-27",
"createdAt": "2026-01-27T12:00:00.000Z",
"milk": "cow",
"rating": 4,
"priceUnit": "usdPerLb",
"isGrassfed": false,
"isRaw": false,
"texture": "semiFirm",
"notes": "",
"flavors": {
"caramel": 5,
"nutty": 5
}
},
{
"id": "fx-027",
"cheeseName": "Fixture cheese 27",
"tastedAt": "2026-01-28",
"createdAt": "2026-01-28T12:00:00.000Z",
"milk": "cow",
"rating": 4,
"priceUnit": "usdPerLb",
"isGrassfed": false,
"isRaw": false,
"texture": "semiFirm",
"notes": "",
"flavors": {
"caramel": 3,
"nutty": 3
}
},
{
"id": "fx-028",
"cheeseName": "Fixture cheese 28",
"tastedAt": "2026-02-01",
"createdAt": "2026-02-01T12:00:00.000Z",
"milk": "cow",
"rating": 4,
"priceUnit": "usdPerLb",
"isGrassfed": false,
"isRaw": false,
"texture": "semiFirm",
"notes": "",
"flavors": {
"caramel": 4
}
},
{
"id": "fx-029",
"cheeseName": "Fixture cheese 29",
"tastedAt": "2026-02-02",
"createdAt": "2026-02-02T12:00:00.000Z",
"milk": "cow",
"rating": 4,
"priceUnit": "usdPerLb",
"isGrassfed": false,
"isRaw": false,
"texture": "semiFirm",
"notes": "",
"flavors": {
"caramel": 5
}
},
{
"id": "fx-030",
"cheeseName": "Fixture cheese 30",
"tastedAt": "2026-02-03",
"createdAt": "2026-02-03T12:00:00.000Z",
"milk": "cow",
"rating": 4,
"priceUnit": "usdPerLb",
"isGrassfed": false,
"isRaw": false,
"texture": "semiFirm",
"notes": "",
"flavors": {
"caramel": 3,
"lemon": 1
}
},
{
"id": "fx-031",
"cheeseName": "Fixture cheese 31",
"tastedAt": "2026-02-04",
"createdAt": "2026-02-04T12:00:00.000Z",
"milk": "cow",
"rating": 4,
"priceUnit": "usdPerLb",
"isGrassfed": false,
"isRaw": false,
"texture": "semiFirm",
"notes": "",
"flavors": {
"caramel": 4
}
},
{
"id": "fx-032",